<?xml version="1.0" encoding="UTF-8"?>
<KnowledgeSystem xmlns="http://example.com/knowledge"
                 xmlns:xsi="http://www.w3.org/2001/XMLSchema-instance"
                 xsi:schemaLocation="http://example.com/knowledge schema.xsd">

  <SchemaMetadata>
    <Version>1.0</Version>
    <Description>A metamorphic, fisheye-abstracted knowledge structure</Description>
    <Author>Team Revolutionary</Author>
    <CreatedDate>2024-12-10</CreatedDate>
  </SchemaMetadata>

  <MetaLayers>
    <MetaLayer index="0" role="Catalyst">
      <Description>Initial seed of the concept</Description>
      <SeedPhrase>Awaken and Generate Metadata...</SeedPhrase>
      <Abstractions>
        <Abstraction level="detailed">
          <Content>
            As Gregor Samsa awoke one morning from uneasy dreams he found himself transformed in his bed into a gigantic insect...
          </Content>
          <ContextualReferences>
            <ZoomOutRef>#MediumView_0</ZoomOutRef>
          </ContextualReferences>
        </Abstraction>
        <Abstraction level="medium" xml:id="MediumView_0">
          <Content>Gregor Samsa wakes as a giant insect, struggling with his new form.</Content>
          <ContextualReferences>
            <ZoomInRef>#</ZoomInRef> <!-- Zoom in to detailed -->
            <ZoomOutRef>#HighView_0</ZoomOutRef>
          </ContextualReferences>
        </Abstraction>
        <Abstraction level="summary" xml:id="HighView_0">
          <Content>Man unexpectedly becomes an insect overnight.</Content>
          <ContextualReferences>
            <ZoomInRef>#MediumView_0</ZoomInRef>
          </ContextualReferences>
        </Abstraction>
      </Abstractions>
      <EvolutionLinks>
        <NextLayerRef>#MetaLayer1</NextLayerRef>
      </EvolutionLinks>
    </MetaLayer>

    <MetaLayer index="1" role="Transmutation" xml:id="MetaLayer1">
      <Description>Refinement of the concept</Description>
      <SeedPhrase>Awaken and Generate Metadata in metamorphic reasoning...</SeedPhrase>
      <Abstractions>
        <Abstraction level="detailed">
          <Content>An illustration of a fish, close up, showing scales and reflections...</Content>
          <ContextualReferences>
            <ZoomOutRef>#FishMedium_1</ZoomOutRef>
            <PreviousIterationRef>#MetaLayer0</PreviousIterationRef>
          </ContextualReferences>
        </Abstraction>
        <Abstraction level="medium" xml:id="FishMedium_1">
          <Content>An illustration of a fish, medium zoom, details fade slightly...</Content>
          <ContextualReferences>
            <ZoomInRef>#</ZoomInRef>
            <ZoomOutRef>#FishHigh_1</ZoomOutRef>
            <PreviousIterationRef>#MetaLayer0</PreviousIterationRef>
          </ContextualReferences>
        </Abstraction>
        <Abstraction level="summary" xml:id="FishHigh_1">
          <Content>A distant view: the fish as just color in a school.</Content>
          <ContextualReferences>
            <ZoomInRef>#FishMedium_1</ZoomInRef>
            <PreviousIterationRef>#MetaLayer0</PreviousIterationRef>
          </ContextualReferences>
        </Abstraction>
      </Abstractions>
    </MetaLayer>
  </MetaLayers>

  <ConceptualGraph>
    <Concept id="C1">
      <Name>Metamorphosis</Name>
      <RelatedConcepts>
        <Related>Transformation</Related>
        <Related>Abstraction</Related>
      </RelatedConcepts>
    </Concept>
    <Concept id="C2">
      <Name>FisheyeAbstraction</Name>
      <RelatedConcepts>
        <Related>Zooming</Related>
        <Related>Contextual Overview</Related>
      </RelatedConcepts>
    </Concept>
  </ConceptualGraph>

  <ResourceLinks>
    <Link url="http://example.com/documentation" description="Documentation for schema usage"/>
  </ResourceLinks>

</KnowledgeSystem>
